<!ELEMENT database (table+)>
<!ELEMENT table (name, columns, rows)>
<!ELEMENT name (#PCDATA)>
<!ELEMENT columns (column+)>
<!ELEMENT column (name, type, constraints?)>
<!ELEMENT name (#PCDATA)>
<!ELEMENT type (#PCDATA)>
<!ELEMENT constraints (constraint*)>
<!ELEMENT constraint (#PCDATA)>
